{
  "kind": "ControlRegistry",
  "schemaVersion": "0.1.0",
  "registryVersion": "0.1.1",
  "upstream": {
    "osSchemaVersion": "0.1.0",
    "capabilityTaxonomyVersion": "0.1.0"
  },
  "controls": [
    {
      "id": "CTL-PRODUCT-001",
      "version": "0.1.0",
      "title": "Problem, users and scope are defined",
      "domain": "PRODUCT",
      "capabilityRefs": [
        "product.product_strategy",
        "product.jtbd"
      ],
      "objective": "The target users, problem, core jobs and non-goals are written down and consistent with what the product actually implements.",
      "applicability": {
        "projectTypes": [
          "ALL"
        ],
        "onUnknown": "INCLUDE"
      },
      "riskWeight": 2,
      "requiredPlane": "EITHER",
      "evidenceRequirements": [
        {
          "sourceKinds": [
            "DOCUMENTATION",
            "SOURCE_CODE"
          ],
          "minStrength": "E2",
          "description": "Product definition doc cross-checked against implemented routes/features."
        }
      ],
      "evidenceKindCaps": {
        "DOCUMENTATION": 70
      },
      "scoringRule": {
        "ABSENT": "No product definition anywhere.",
        "PARTIAL": "Fragments (README tagline) without users/problem/scope.",
        "IMPLEMENTED_UNVERIFIED": "Definition exists but not cross-checked to implementation.",
        "IMPLEMENTED_STRONG": "Definition matches implemented feature surface.",
        "VERIFIED": "Definition confirmed by owner and matched to live product."
      },
      "findingTemplates": [
        {
          "templateId": "FT-PRODUCT-001-B",
          "whenStatusIn": [
            "ABSENT"
          ],
          "severity": "MEDIUM",
          "title": "Not implemented: problem, users and scope are defined",
          "impact": "No implementation was found. If launched without it: Prioritization, positioning and remediation scope cannot be judged against intent.",
          "recommendation": "Implement before launch: The target users, problem, core jobs and non-goals are written down and consistent with what the product actually implements.",
          "verificationRequired": {
            "method": "HUMAN_REVIEW",
            "minStrength": "E2",
            "description": "Owner confirms profile; auditor matches features."
          }
        },
        {
          "templateId": "FT-PRODUCT-001-A",
          "whenStatusIn": [
            "PARTIAL"
          ],
          "severity": "MEDIUM",
          "title": "Product definition missing or incomplete",
          "impact": "Prioritization, positioning and remediation scope cannot be judged against intent.",
          "recommendation": "Generate PROJECT.md / ProjectProfile from confirmed owner input and discovered features.",
          "verificationRequired": {
            "method": "HUMAN_REVIEW",
            "minStrength": "E2",
            "description": "Owner confirms profile; auditor matches features."
          }
        }
      ],
      "launchBlocker": {
        "enabled": false
      }
    },
    {
      "id": "CTL-ARCHITECTURE-001",
      "version": "0.1.0",
      "title": "Architecture boundaries are explicit and match the code",
      "domain": "ARCHITECTURE",
      "capabilityRefs": [
        "recovery.architecture_inference",
        "docs.architecture_docs"
      ],
      "objective": "Components, data flow and trust boundaries are identifiable in code structure and documented consistently.",
      "applicability": {
        "projectTypes": [
          "ALL"
        ],
        "onUnknown": "INCLUDE"
      },
      "riskWeight": 3,
      "requiredPlane": "REPOSITORY",
      "evidenceRequirements": [
        {
          "sourceKinds": [
            "SOURCE_CODE",
            "CONFIGURATION"
          ],
          "minStrength": "E3",
          "description": "Module/directory structure and import graph show the boundaries."
        }
      ],
      "scoringRule": {
        "ABSENT": "No discernible boundaries (UI, data access and secrets mixed freely).",
        "PARTIAL": "Some separation; server/client or data-access boundaries leak.",
        "IMPLEMENTED_UNVERIFIED": "Boundaries visible but undocumented or unchecked.",
        "IMPLEMENTED_STRONG": "Boundaries clear in code and docs agree with code.",
        "VERIFIED": "Boundaries enforced by tooling (lint rules/import constraints) that ran."
      },
      "findingTemplates": [
        {
          "templateId": "FT-ARCHITECTURE-001-B",
          "whenStatusIn": [
            "ABSENT"
          ],
          "severity": "MEDIUM",
          "title": "Not implemented: architecture boundaries are explicit and match the code",
          "impact": "No implementation was found. If launched without it: Changes have unpredictable blast radius; security boundaries are hard to reason about.",
          "recommendation": "Implement before launch: Components, data flow and trust boundaries are identifiable in code structure and documented consistently.",
          "verificationRequired": {
            "method": "CODE_REVIEW",
            "minStrength": "E3",
            "description": "Re-inspect boundaries in CURRENT snapshot."
          }
        },
        {
          "templateId": "FT-ARCHITECTURE-001-A",
          "whenStatusIn": [
            "PARTIAL"
          ],
          "severity": "MEDIUM",
          "title": "Architecture boundaries unclear or leaking",
          "impact": "Changes have unpredictable blast radius; security boundaries are hard to reason about.",
          "recommendation": "Document inferred architecture and fix the leaking boundaries listed in evidence.",
          "verificationRequired": {
            "method": "CODE_REVIEW",
            "minStrength": "E3",
            "description": "Re-inspect boundaries in CURRENT snapshot."
          }
        }
      ],
      "launchBlocker": {
        "enabled": false
      }
    },
    {
      "id": "CTL-ARCHITECTURE-002",
      "version": "0.1.0",
      "title": "Environment configuration is separated from code",
      "domain": "ARCHITECTURE",
      "capabilityRefs": [
        "infra.environments",
        "infra.secrets"
      ],
      "objective": "Environment-specific values come from configuration/secret stores; production and test settings cannot be confused.",
      "applicability": {
        "projectTypes": [
          "ALL"
        ],
        "onUnknown": "INCLUDE"
      },
      "riskWeight": 3,
      "requiredPlane": "REPOSITORY",
      "evidenceRequirements": [
        {
          "sourceKinds": [
            "SOURCE_CODE",
            "CONFIGURATION"
          ],
          "minStrength": "E3",
          "description": "Env var usage, example env files, hard-coded URLs/keys search."
        }
      ],
      "scoringRule": {
        "ABSENT": "Environment values hard-coded throughout.",
        "PARTIAL": "Mixed: some env vars, some hard-coded endpoints/flags.",
        "IMPLEMENTED_UNVERIFIED": "Env-driven config, no validation of required vars.",
        "IMPLEMENTED_STRONG": "Env-driven with schema validation at startup and documented example.",
        "VERIFIED": "Startup validation executed and fails closed on missing vars."
      },
      "findingTemplates": [
        {
          "templateId": "FT-ARCHITECTURE-002-B",
          "whenStatusIn": [
            "ABSENT"
          ],
          "severity": "MEDIUM",
          "title": "Not implemented: environment configuration is separated from code",
          "impact": "No implementation was found. If launched without it: Risk of production/test confusion and secret exposure.",
          "recommendation": "Implement before launch: Environment-specific values come from configuration/secret stores; production and test settings cannot be confused.",
          "verificationRequired": {
            "method": "CODE_REVIEW",
            "minStrength": "E3",
            "description": "Search CURRENT snapshot for hard-coded environment values."
          }
        },
        {
          "templateId": "FT-ARCHITECTURE-002-A",
          "whenStatusIn": [
            "PARTIAL"
          ],
          "severity": "MEDIUM",
          "title": "Environment configuration hard-coded",
          "impact": "Risk of production/test confusion and secret exposure.",
          "recommendation": "Move environment values to validated configuration.",
          "verificationRequired": {
            "method": "CODE_REVIEW",
            "minStrength": "E3",
            "description": "Search CURRENT snapshot for hard-coded environment values."
          }
        }
      ],
      "launchBlocker": {
        "enabled": false
      }
    },
    {
      "id": "CTL-CODE_QUALITY-001",
      "version": "0.1.0",
      "title": "Typecheck, lint and build pass",
      "domain": "CODE_QUALITY",
      "capabilityRefs": [
        "team.code_review",
        "recovery.tech_debt"
      ],
      "objective": "The project's own typecheck/lint/build commands exist and pass on the snapshot.",
      "applicability": {
        "projectTypes": [
          "ALL"
        ],
        "onUnknown": "INCLUDE"
      },
      "riskWeight": 3,
      "requiredPlane": "REPOSITORY",
      "evidenceRequirements": [
        {
          "sourceKinds": [
            "COMMAND_OUTPUT"
          ],
          "minStrength": "E4",
          "description": "Sandboxed execution of declared build/typecheck/lint scripts."
        }
      ],
      "scoringRule": {
        "ABSENT": "No build/lint/typecheck tooling configured.",
        "PARTIAL": "Tooling configured but commands fail.",
        "IMPLEMENTED_UNVERIFIED": "Tooling configured, not executed.",
        "IMPLEMENTED_STRONG": "Commands pass with warnings or partial coverage (e.g. lint excludes large areas).",
        "VERIFIED": "All declared commands pass cleanly in sandbox."
      },
      "automatedChecks": [
        "det.scripts.build_lint_typecheck"
      ],
      "findingTemplates": [
        {